{
  "$schema": "../incident-patch-readiness-review.schema.json",
  "schema_version": 1,
  "review_id": "SEC.INCIDENT_READINESS_REVIEW.NOCLAIM_TEMPLATE.2026_07",
  "status": "no_claim_incident_patch_readiness_template",
  "updated": "2026-07-18",
  "claim_status": "Incident/patch readiness-review template only; no owner review, no independent review, no security review, no release-operations review, no legal review, no support review, no executed private-intake tabletop, no emergency patch dry run, no regression or backport evidence, no signing or update dry-run evidence, no coordinated disclosure rehearsal, no postmortem evidence, no role matrix review, no backup-owner coverage, no incident-response readiness claim, no emergency patch capacity claim, no supported security versions claim, no production-safe browsing claim, no disclosure authority claim, no stable promotion authority claim, no signing authority claim, no incident closure authority claim, and no implementation claim.",
  "source_records": [
    "docs/research/incident-patch-rehearsal-inventory-2026-07.md",
    "docs/security-engine/machine/incident-patch-rehearsal.schema.json",
    "docs/security-engine/machine/incident-patch-rehearsal.json",
    "docs/security-engine/machine/incident-patch-rehearsal-record.schema.json",
    "docs/security-engine/machine/incident-patch-rehearsal-records/no-claim-incident-patch-rehearsal-template.json",
    "docs/security-engine/machine/incident-patch-readiness-review.schema.json",
    "docs/security-engine/machine/incident-patch-readiness-reviews/no-claim-incident-patch-readiness-template.json",
    "docs/blueprint-v1/machine/pre-build-readiness.json",
    "docs/blueprint-v1/machine/build-readiness-task-queue.json",
    "docs/blueprint-v1/machine/research-readiness-crosswalk.json",
    "docs/security.md",
    "docs/security-engine/README.md",
    "docs/security-engine/05-update-supply-chain-and-vulnerability-response.md",
    "docs/security-engine/06-security-verification-and-release-gates.md",
    "docs/release-operations/README.md",
    "docs/release-operations/08-vulnerability-response-and-supported-lifecycle.md",
    "docs/production-readiness/README.md",
    "docs/production-readiness/06-security-and-vulnerability-response-gates.md",
    "docs/production-readiness/14-legal-signing-and-human-release-authority.md",
    "tools/validate_incident_patch_rehearsal.py",
    "tools/validate_incident_patch_readiness_review.py",
    "tools/validate_blueprint.py",
    "tools/check.ps1"
  ],
  "review_scope": {
    "rehearsal_record": null,
    "reference_platform": null,
    "private_channel": null,
    "owner_reviewer": null,
    "independent_reviewer": null,
    "security_reviewer": null,
    "release_operations_reviewer": null,
    "legal_reviewer": null,
    "support_reviewer": null,
    "review_status": "template_only_no_review",
    "prohibited_placeholder_policy": "Template records must not leave null fields in a real review or name placeholder rehearsal records, reference platforms, private channels, owner reviewers, independent reviewers, security reviewers, release-operations reviewers, legal reviewers, support reviewers, title-only approval, self-approval, incident closure approval, signing authority, disclosure authority, stable promotion authority, or implied production incident authority."
  },
  "readiness_status": {
    "owner_reviewed": false,
    "independent_reviewed": false,
    "security_reviewed": false,
    "release_operations_reviewed": false,
    "legal_reviewed": false,
    "support_reviewed": false,
    "private_intake_tabletop_reviewed": false,
    "emergency_patch_dry_run_reviewed": false,
    "regression_backport_reviewed": false,
    "signing_update_dry_run_reviewed": false,
    "disclosure_rehearsal_reviewed": false,
    "postmortem_reviewed": false,
    "role_matrix_reviewed": false,
    "backup_owner_coverage_reviewed": false,
    "incident_response_readiness_approved": false,
    "emergency_patch_capacity_approved": false,
    "supported_security_versions_approved": false,
    "production_safe_browsing_approved": false,
    "disclosure_authority_approved": false,
    "stable_promotion_approved": false,
    "signing_authority_approved": false,
    "incident_closure_authority_approved": false,
    "implementation_claim_supported": false
  },
  "private_intake_axes": [
    { "axis": "report access control", "required_evidence": "Executed private-intake tabletop proves private report channel, named access roles, audit trail, and confidential evidence handling beyond the checked no-claim incident/patch readiness-review template.", "template_status": "missing in template" },
    { "axis": "acknowledgement", "required_evidence": "Executed tabletop records acknowledgement timing, response content, private-channel preservation, and no unsupported public promises beyond the checked no-claim incident/patch readiness-review template.", "template_status": "missing in template" },
    { "axis": "reproduction", "required_evidence": "Private reproduction evidence records fake vulnerability facts, affected build, platform, configuration, sanitized artifacts, and owner review beyond the checked no-claim incident/patch readiness-review template.", "template_status": "missing in template" },
    { "axis": "severity", "required_evidence": "Severity review records asset impact, boundary crossed, reachability, prerequisites, confidence, reviewer, and no agent-decided severity beyond the checked no-claim incident/patch readiness-review template.", "template_status": "missing in template" },
    { "axis": "asset analysis", "required_evidence": "Asset analysis records origin, profile, credential, update, signing, file, network, extension, DevTools, agent, package, and channel scope beyond the checked no-claim incident/patch readiness-review template.", "template_status": "missing in template" },
    { "axis": "affected-version statement", "required_evidence": "Affected-version review records supported and unsupported branches, impacted commits, residual uncertainty, and user-facing boundary beyond the checked no-claim incident/patch readiness-review template.", "template_status": "missing in template" },
    { "axis": "embargo handling", "required_evidence": "Embargo review records participants, evidence locations, expiry triggers, escalation path, and disclosure authority boundary beyond the checked no-claim incident/patch readiness-review template.", "template_status": "missing in template" },
    { "axis": "sanitized evidence preservation", "required_evidence": "Sanitized evidence records hashes, redaction decisions, retention, restricted storage, and no exploitable public detail beyond the checked no-claim incident/patch readiness-review template.", "template_status": "missing in template" }
  ],
  "emergency_patch_axes": [
    { "axis": "protected patch branch", "required_evidence": "Emergency patch dry run proves protected branch settings, restricted visibility, reviewer requirements, and no self-approval.", "template_status": "not run in template" },
    { "axis": "embargoed CI", "required_evidence": "Embargoed CI evidence records commands, private logs, redaction checks, failure handling, and no public exploit details.", "template_status": "not run in template" },
    { "axis": "regression test", "required_evidence": "Regression evidence proves the fake vulnerability fix is tested without exposing payloads or unsupported production claims.", "template_status": "not run in template" },
    { "axis": "backport decision", "required_evidence": "Backport decision records supported branches, unsupported branches, owner review, and residual risk.", "template_status": "not run in template" },
    { "axis": "signing and update dry run", "required_evidence": "Signing and update dry run uses fake keys only, links update metadata, and rejects production signing keys or stable channels.", "template_status": "not run in template" },
    { "axis": "staged rollout", "required_evidence": "Staged rollout evidence records fake cohort, pause, rollback, hold, and no public distribution behavior.", "template_status": "not run in template" },
    { "axis": "minimum secure version", "required_evidence": "Minimum secure version evidence records vulnerable-version refusal and update metadata linkage.", "template_status": "not run in template" },
    { "axis": "revocation", "required_evidence": "Revocation evidence records fake-key or fake-target revocation and rejection behavior.", "template_status": "not run in template" },
    { "axis": "release notes", "required_evidence": "Release-note draft records security, legal, release, support, affected-version, mitigation, and no premature disclosure approval.", "template_status": "not run in template" },
    { "axis": "user and admin communication", "required_evidence": "User and admin communication draft records timing, mitigation, supported scope, support boundary, and owner approval needs.", "template_status": "not run in template" },
    { "axis": "CVE and credit handling", "required_evidence": "CVE and credit handling records coordination state, credit preference, disclosure timing, and legal/security review needs.", "template_status": "not run in template" },
    { "axis": "coordinated disclosure", "required_evidence": "Coordinated disclosure evidence records embargo, reporter communication, public advisory boundary, and disclosure authority holder.", "template_status": "not run in template" },
    { "axis": "postmortem remediation", "required_evidence": "Postmortem evidence records root cause, systemic fixes, tests, documentation updates, owners, deadlines, and closure blockers.", "template_status": "not run in template" }
  ],
  "incident_class_axes": [